{
  "version": "vouch.agent_task.v0",
  "id": "task:demo-001",
  "transaction_id": "tx:demo-001",
  "namespace": "fixture",
  "run_id": "run:agent-001",
  "intent": "Update the authentication middleware and its tests.",
  "intent_digest": "sha256:88ba931d885aaa6b875ec91cf0328b9dca76f7e8e27e0ac4fcec62146049b325",
  "agent_profile": {
    "id": "agent-profile:fixture",
    "digest": "sha256:1111111111111111111111111111111111111111111111111111111111111111",
    "runtime_class": "oci",
    "image_digest": "sha256:2222222222222222222222222222222222222222222222222222222222222222",
    "command_digest": "sha256:3333333333333333333333333333333333333333333333333333333333333333"
  },
  "created_at": "2025-01-02T03:04:05Z",
  "digest": "sha256:c07dd28b928ce64d6fa226e1f9ad668640cb8955e5718b3502d2eed3ce433d66"
}
